{
  "schema_version": "approval-record.v1",
  "approval_id": "apr-demo-001",
  "publication_id": "pub-obs-demo-001-e4633809175c",
  "draft_sha256": "e4633809175cab9a3247f4959308ddd08a3e125acca789c830d4cbd38818b2dc",
  "status": "approved",
  "decided_by": "operator@example.com",
  "decided_at": "2026-09-11T05:00:00Z",
  "reason": null,
  "policy_version": null
}
